{
  "schema_version": "1.0.0",
  "checkpoint": "after_pick_10",
  "roster_slots": [
    {
      "position": "OF",
      "count": 3
    }
  ],
  "scoring_categories": [
    {
      "name": "HR",
      "type": "batting"
    }
  ],
  "total_budget": 260,
  "num_teams": 12,
  "league_scope": "Mixed",
  "scoring_format": "5x5",
  "drafted_players": [
    {
      "player_id": "1",
      "name": "P1",
      "position": "OF",
      "team": "NYY",
      "team_id": "team_1",
      "paid": 5,
      "pick_number": 1
    },
    {
      "player_id": "2",
      "name": "P2",
      "position": "OF",
      "team": "NYY",
      "team_id": "team_2",
      "paid": 6,
      "pick_number": 2
    },
    {
      "player_id": "3",
      "name": "P3",
      "position": "OF",
      "team": "NYY",
      "team_id": "team_3",
      "paid": 7,
      "pick_number": 3
    },
    {
      "player_id": "4",
      "name": "P4",
      "position": "OF",
      "team": "NYY",
      "team_id": "team_4",
      "paid": 8,
      "pick_number": 4
    },
    {
      "player_id": "5",
      "name": "P5",
      "position": "OF",
      "team": "NYY",
      "team_id": "team_5",
      "paid": 9,
      "pick_number": 5
    },
    {
      "player_id": "6",
      "name": "P6",
      "position": "OF",
      "team": "NYY",
      "team_id": "team_6",
      "paid": 10,
      "pick_number": 6
    },
    {
      "player_id": "7",
      "name": "P7",
      "position": "OF",
      "team": "NYY",
      "team_id": "team_7",
      "paid": 11,
      "pick_number": 7
    },
    {
      "player_id": "8",
      "name": "P8",
      "position": "OF",
      "team": "NYY",
      "team_id": "team_8",
      "paid": 12,
      "pick_number": 8
    },
    {
      "player_id": "9",
      "name": "P9",
      "position": "OF",
      "team": "NYY",
      "team_id": "team_9",
      "paid": 13,
      "pick_number": 9
    },
    {
      "player_id": "10",
      "name": "P10",
      "position": "OF",
      "team": "NYY",
      "team_id": "team_10",
      "paid": 14,
      "pick_number": 10
    }
  ],
  "deterministic": true,
  "seed": 42,
  "minors": [],
  "taxi": []
}